{
  "apiVersion": "effecta.dev/v1",
  "artifact": {
    "digest": "sha256:fc9277f833a7847d17878e2317db83ca3c98bc7288d602d9a11dc7d2c9b02593",
    "mediaType": "application/vnd.effecta.skill.directory.v1",
    "path": "community-skills/writing/lead-magnets--coreyhaines31-marketingskills"
  },
  "compatibility": {
    "declared": false,
    "runtimes": [
      "agent-skill"
    ]
  },
  "content": {
    "digest": "sha256:fc9277f833a7847d17878e2317db83ca3c98bc7288d602d9a11dc7d2c9b02593",
    "fileCount": 4,
    "totalBytes": 29029
  },
  "dependencies": {
    "items": [],
    "status": "not-declared"
  },
  "kind": "CapabilityRelease",
  "license": {
    "redistribution": "allowed",
    "spdx": "MIT"
  },
  "packageId": "github:coreyhaines31/marketingskills:skills/lead-magnets",
  "permissions": {
    "commands": [],
    "filesystem": [],
    "network": [],
    "status": "not-declared"
  },
  "releaseId": "sha256:53eb7f64f42c7f414394fe2e803f4a49bb5cc875088d59d2a1ce4301ec5723e8",
  "security": {
    "staticScan": {
      "findings": [],
      "status": "passed"
    }
  },
  "smokeTests": [],
  "source": {
    "commit": "7868cb9251fad80a73d26e488a5ad5f6c4a9f335",
    "path": "skills/lead-magnets",
    "repository": "coreyhaines31/marketingskills",
    "url": "https://github.com/coreyhaines31/marketingskills/tree/7868cb9251fad80a73d26e488a5ad5f6c4a9f335/skills/lead-magnets"
  },
  "status": "extracted"
}
