{
  "apiVersion": "effecta.dev/v1",
  "artifact": {
    "digest": "sha256:fc901312c2f75fbec5e8e2a28afb79f18a619fbd60519bef5643f1c48a5b418b",
    "mediaType": "application/vnd.effecta.skill.directory.v1",
    "path": "community-skills/engineering/pytorch-lightning--k-dense-ai-scientific-agent-skills"
  },
  "compatibility": {
    "declared": false,
    "runtimes": [
      "agent-skill"
    ]
  },
  "content": {
    "digest": "sha256:fc901312c2f75fbec5e8e2a28afb79f18a619fbd60519bef5643f1c48a5b418b",
    "fileCount": 11,
    "totalBytes": 139842
  },
  "dependencies": {
    "items": [],
    "status": "not-declared"
  },
  "kind": "CapabilityRelease",
  "license": {
    "redistribution": "allowed",
    "spdx": "MIT"
  },
  "packageId": "github:k-dense-ai/scientific-agent-skills:skills/pytorch-lightning",
  "permissions": {
    "commands": [],
    "filesystem": [],
    "network": [],
    "status": "not-declared"
  },
  "releaseId": "sha256:498efff3cdd8707c79a0e1094ea4cf29448b180769e2e92e350f8c1e5070e5b3",
  "security": {
    "staticScan": {
      "findings": [],
      "status": "passed"
    }
  },
  "smokeTests": [],
  "source": {
    "commit": "b2a92ba052dcae4ef48e850b9e31ebf75706be48",
    "path": "skills/pytorch-lightning",
    "repository": "K-Dense-AI/scientific-agent-skills",
    "url": "https://github.com/K-Dense-AI/scientific-agent-skills/tree/b2a92ba052dcae4ef48e850b9e31ebf75706be48/skills/pytorch-lightning"
  },
  "status": "extracted"
}
