{
  "apiVersion": "effecta.dev/v1",
  "artifact": {
    "digest": "sha256:3829db14e7ccee629cded46e3cbaed3552e47aa429426e4e612eb8a8a0ec1e08",
    "mediaType": "application/vnd.effecta.skill.directory.v1",
    "path": "community-skills/workflow/autonomous-agent-harness--affaan-m-ecc"
  },
  "compatibility": {
    "declared": false,
    "runtimes": [
      "agent-skill"
    ]
  },
  "content": {
    "digest": "sha256:3829db14e7ccee629cded46e3cbaed3552e47aa429426e4e612eb8a8a0ec1e08",
    "fileCount": 1,
    "totalBytes": 10860
  },
  "dependencies": {
    "items": [],
    "status": "not-declared"
  },
  "kind": "CapabilityRelease",
  "license": {
    "redistribution": "allowed",
    "spdx": "MIT"
  },
  "packageId": "github:affaan-m/ecc:skills/autonomous-agent-harness",
  "permissions": {
    "commands": [],
    "filesystem": [],
    "network": [],
    "status": "not-declared"
  },
  "releaseId": "sha256:724d1113e1ef197bd7524449f51ba0efe8c0b93ceed353d1c4c2ab5613e969a2",
  "security": {
    "staticScan": {
      "findings": [],
      "status": "passed"
    }
  },
  "smokeTests": [],
  "source": {
    "commit": "c9de8f5b2b3a225bca9befa2b7700aa5e3a4d1b8",
    "path": "skills/autonomous-agent-harness",
    "repository": "affaan-m/ECC",
    "url": "https://github.com/affaan-m/ECC/tree/c9de8f5b2b3a225bca9befa2b7700aa5e3a4d1b8/skills/autonomous-agent-harness"
  },
  "status": "extracted"
}
