{
  "apiVersion": "effecta.dev/v1",
  "artifact": {
    "digest": "sha256:9b04a03712a546a52807d34029e763bc318a9c4aa07729d9722715d4790d3b3f",
    "mediaType": "application/vnd.effecta.skill.directory.v1",
    "path": "community-skills/writing/job-stories--phuryn-pm-skills"
  },
  "compatibility": {
    "declared": false,
    "runtimes": [
      "agent-skill"
    ]
  },
  "content": {
    "digest": "sha256:9b04a03712a546a52807d34029e763bc318a9c4aa07729d9722715d4790d3b3f",
    "fileCount": 1,
    "totalBytes": 2969
  },
  "dependencies": {
    "items": [],
    "status": "not-declared"
  },
  "kind": "CapabilityRelease",
  "license": {
    "redistribution": "allowed",
    "spdx": "MIT"
  },
  "packageId": "github:phuryn/pm-skills:pm-execution/skills/job-stories",
  "permissions": {
    "commands": [],
    "filesystem": [],
    "network": [],
    "status": "not-declared"
  },
  "releaseId": "sha256:57fc30201818dbd49914fc32715fbb6ddeddc16ccfac7d307566b006603bfbb9",
  "security": {
    "staticScan": {
      "findings": [],
      "status": "passed"
    }
  },
  "smokeTests": [],
  "source": {
    "commit": "18468a95b427e70e258b51389796367c6f684e7d",
    "path": "pm-execution/skills/job-stories",
    "repository": "phuryn/pm-skills",
    "url": "https://github.com/phuryn/pm-skills/tree/18468a95b427e70e258b51389796367c6f684e7d/pm-execution/skills/job-stories"
  },
  "status": "extracted"
}
