{
  "apiVersion": "effecta.dev/v1",
  "artifact": {
    "digest": "sha256:067c2cd91ff94550873b64955747765ce4abce175927d9c407d14beb87d9c82f",
    "mediaType": "application/vnd.effecta.skill.directory.v1",
    "path": "community-skills/workflow/agent-introspection-debugging--affaan-m-ecc"
  },
  "compatibility": {
    "declared": false,
    "runtimes": [
      "agent-skill"
    ]
  },
  "content": {
    "digest": "sha256:067c2cd91ff94550873b64955747765ce4abce175927d9c407d14beb87d9c82f",
    "fileCount": 2,
    "totalBytes": 5905
  },
  "dependencies": {
    "items": [],
    "status": "not-declared"
  },
  "kind": "CapabilityRelease",
  "license": {
    "redistribution": "allowed",
    "spdx": "MIT"
  },
  "packageId": "github:affaan-m/ecc:.agents/skills/agent-introspection-debugging",
  "permissions": {
    "commands": [],
    "filesystem": [],
    "network": [],
    "status": "not-declared"
  },
  "releaseId": "sha256:a59ec5b74cef561701212334728c385b7b021c34f25cd020d73d14352531a056",
  "security": {
    "staticScan": {
      "findings": [],
      "status": "passed"
    }
  },
  "smokeTests": [],
  "source": {
    "commit": "c9de8f5b2b3a225bca9befa2b7700aa5e3a4d1b8",
    "path": ".agents/skills/agent-introspection-debugging",
    "repository": "affaan-m/ECC",
    "url": "https://github.com/affaan-m/ECC/tree/c9de8f5b2b3a225bca9befa2b7700aa5e3a4d1b8/.agents/skills/agent-introspection-debugging"
  },
  "status": "extracted"
}
