{
  "apiVersion": "effecta.dev/v1",
  "artifact": {
    "digest": "sha256:3affacf18f64ad3061aea7973e222d9bea5a67cf0fbb4829d44170e015a4082b",
    "mediaType": "application/vnd.effecta.skill.directory.v1",
    "path": "community-skills/research/scientific-writing--k-dense-ai-scientific-agent-skills"
  },
  "compatibility": {
    "declared": false,
    "runtimes": [
      "agent-skill"
    ]
  },
  "content": {
    "digest": "sha256:3affacf18f64ad3061aea7973e222d9bea5a67cf0fbb4829d44170e015a4082b",
    "fileCount": 31,
    "totalBytes": 172523
  },
  "dependencies": {
    "items": [],
    "status": "not-declared"
  },
  "kind": "CapabilityRelease",
  "license": {
    "redistribution": "allowed",
    "spdx": "MIT"
  },
  "packageId": "github:k-dense-ai/scientific-agent-skills:skills/scientific-writing",
  "permissions": {
    "commands": [],
    "filesystem": [],
    "network": [],
    "status": "not-declared"
  },
  "releaseId": "sha256:e1082c7e5dd8759918be02218132a719acd293039f9073e5c953d1ba967dc479",
  "security": {
    "staticScan": {
      "findings": [],
      "status": "passed"
    }
  },
  "smokeTests": [],
  "source": {
    "commit": "b2a92ba052dcae4ef48e850b9e31ebf75706be48",
    "path": "skills/scientific-writing",
    "repository": "K-Dense-AI/scientific-agent-skills",
    "url": "https://github.com/K-Dense-AI/scientific-agent-skills/tree/b2a92ba052dcae4ef48e850b9e31ebf75706be48/skills/scientific-writing"
  },
  "status": "extracted"
}
