{
  "apiVersion": "effecta.dev/v1",
  "artifact": {
    "digest": "sha256:8027c47cf8094697cd4cff1abcaae15ecb2b2e60fcadb85670e24314bc5fb040",
    "mediaType": "application/vnd.effecta.skill.directory.v1",
    "path": "community-skills/workflow/hermes-imports--affaan-m-ecc"
  },
  "compatibility": {
    "declared": false,
    "runtimes": [
      "agent-skill"
    ]
  },
  "content": {
    "digest": "sha256:8027c47cf8094697cd4cff1abcaae15ecb2b2e60fcadb85670e24314bc5fb040",
    "fileCount": 1,
    "totalBytes": 3006
  },
  "dependencies": {
    "items": [],
    "status": "not-declared"
  },
  "kind": "CapabilityRelease",
  "license": {
    "redistribution": "allowed",
    "spdx": "MIT"
  },
  "packageId": "github:affaan-m/ecc:skills/hermes-imports",
  "permissions": {
    "commands": [],
    "filesystem": [],
    "network": [],
    "status": "not-declared"
  },
  "releaseId": "sha256:b64d3399d9b529cdc856af23d7bdca77e7544480453b6cf5e7cdaaca5625acda",
  "security": {
    "staticScan": {
      "findings": [],
      "status": "passed"
    }
  },
  "smokeTests": [],
  "source": {
    "commit": "c9de8f5b2b3a225bca9befa2b7700aa5e3a4d1b8",
    "path": "skills/hermes-imports",
    "repository": "affaan-m/ECC",
    "url": "https://github.com/affaan-m/ECC/tree/c9de8f5b2b3a225bca9befa2b7700aa5e3a4d1b8/skills/hermes-imports"
  },
  "status": "extracted"
}
