{
  "apiVersion": "effecta.dev/v1",
  "artifact": {
    "digest": "sha256:73640726c8afa212289ca2fb1dfaa2f73eec968d717b1f78448a4fd74d717272",
    "mediaType": "application/vnd.effecta.skill.directory.v1",
    "path": "community-skills/engineering/browser-testing-with-devtools--addyosmani-agent-skills"
  },
  "compatibility": {
    "declared": false,
    "runtimes": [
      "agent-skill"
    ]
  },
  "content": {
    "digest": "sha256:73640726c8afa212289ca2fb1dfaa2f73eec968d717b1f78448a4fd74d717272",
    "fileCount": 1,
    "totalBytes": 14539
  },
  "dependencies": {
    "items": [],
    "status": "not-declared"
  },
  "kind": "CapabilityRelease",
  "license": {
    "redistribution": "allowed",
    "spdx": "MIT"
  },
  "packageId": "github:addyosmani/agent-skills:skills/browser-testing-with-devtools",
  "permissions": {
    "commands": [],
    "filesystem": [],
    "network": [],
    "status": "not-declared"
  },
  "releaseId": "sha256:b65f9df30f2bc08e2f590d33b5c334e652728a6d23622671b40fefb65149f528",
  "security": {
    "staticScan": {
      "findings": [],
      "status": "passed"
    }
  },
  "smokeTests": [],
  "source": {
    "commit": "df1edb2e05487d0aa6d93c747141e0aed1187f25",
    "path": "skills/browser-testing-with-devtools",
    "repository": "addyosmani/agent-skills",
    "url": "https://github.com/addyosmani/agent-skills/tree/df1edb2e05487d0aa6d93c747141e0aed1187f25/skills/browser-testing-with-devtools"
  },
  "status": "extracted"
}
