{
  "apiVersion": "effecta.dev/v1",
  "artifact": {
    "digest": "sha256:f5c7ec410a2c3c35364c670353e7b097ef658ff32a653bb0ce718e43d3711881",
    "mediaType": "application/vnd.effecta.skill.directory.v1",
    "path": "community-skills/workflow/marketing-plan--coreyhaines31-marketingskills"
  },
  "compatibility": {
    "declared": false,
    "runtimes": [
      "agent-skill"
    ]
  },
  "content": {
    "digest": "sha256:f5c7ec410a2c3c35364c670353e7b097ef658ff32a653bb0ce718e43d3711881",
    "fileCount": 15,
    "totalBytes": 246192
  },
  "dependencies": {
    "items": [],
    "status": "not-declared"
  },
  "kind": "CapabilityRelease",
  "license": {
    "redistribution": "allowed",
    "spdx": "MIT"
  },
  "packageId": "github:coreyhaines31/marketingskills:skills/marketing-plan",
  "permissions": {
    "commands": [],
    "filesystem": [],
    "network": [],
    "status": "not-declared"
  },
  "releaseId": "sha256:ee06b95432ca453e8ec33c6218d889dc30c20b4231e53f9d320b75e1f6611cde",
  "security": {
    "staticScan": {
      "findings": [],
      "status": "passed"
    }
  },
  "smokeTests": [],
  "source": {
    "commit": "7868cb9251fad80a73d26e488a5ad5f6c4a9f335",
    "path": "skills/marketing-plan",
    "repository": "coreyhaines31/marketingskills",
    "url": "https://github.com/coreyhaines31/marketingskills/tree/7868cb9251fad80a73d26e488a5ad5f6c4a9f335/skills/marketing-plan"
  },
  "status": "extracted"
}
