{
  "apiVersion": "effecta.dev/v1",
  "artifact": {
    "digest": "sha256:650ba73da185d08f2645df842949f87c8eeea7bbd1555a98dfa836a3b7b30e45",
    "mediaType": "application/vnd.effecta.skill.directory.v1",
    "path": "community-skills/engineering/everything-claude-code--affaan-m-ecc"
  },
  "compatibility": {
    "declared": false,
    "runtimes": [
      "agent-skill"
    ]
  },
  "content": {
    "digest": "sha256:650ba73da185d08f2645df842949f87c8eeea7bbd1555a98dfa836a3b7b30e45",
    "fileCount": 2,
    "totalBytes": 11623
  },
  "dependencies": {
    "items": [],
    "status": "not-declared"
  },
  "kind": "CapabilityRelease",
  "license": {
    "redistribution": "allowed",
    "spdx": "MIT"
  },
  "packageId": "github:affaan-m/ecc:.agents/skills/everything-claude-code",
  "permissions": {
    "commands": [],
    "filesystem": [],
    "network": [],
    "status": "not-declared"
  },
  "releaseId": "sha256:f4f93cf30b528308e61755043cfaadb72cd9694db10b17c1cfb9d99267ab2e8e",
  "security": {
    "staticScan": {
      "findings": [],
      "status": "passed"
    }
  },
  "smokeTests": [],
  "source": {
    "commit": "c9de8f5b2b3a225bca9befa2b7700aa5e3a4d1b8",
    "path": ".agents/skills/everything-claude-code",
    "repository": "affaan-m/ECC",
    "url": "https://github.com/affaan-m/ECC/tree/c9de8f5b2b3a225bca9befa2b7700aa5e3a4d1b8/.agents/skills/everything-claude-code"
  },
  "status": "extracted"
}
