{
  "apiVersion": "effecta.dev/v1",
  "artifact": {
    "digest": "sha256:2e9aecc57ec45a5eedc1db65ce5769a43aa32a23432a38cb0529727f66c509fe",
    "mediaType": "application/vnd.effecta.skill.directory.v1",
    "path": "community-skills/workflow/analytics--coreyhaines31-marketingskills"
  },
  "compatibility": {
    "declared": false,
    "runtimes": [
      "agent-skill"
    ]
  },
  "content": {
    "digest": "sha256:2e9aecc57ec45a5eedc1db65ce5769a43aa32a23432a38cb0529727f66c509fe",
    "fileCount": 5,
    "totalBytes": 37567
  },
  "dependencies": {
    "items": [],
    "status": "not-declared"
  },
  "kind": "CapabilityRelease",
  "license": {
    "redistribution": "allowed",
    "spdx": "MIT"
  },
  "packageId": "github:coreyhaines31/marketingskills:skills/analytics",
  "permissions": {
    "commands": [],
    "filesystem": [],
    "network": [],
    "status": "not-declared"
  },
  "releaseId": "sha256:bc223cc11cb7ea54d13d86b1c1ce128c5fc9a1554d2f4464df03c06b66a1058b",
  "security": {
    "staticScan": {
      "findings": [],
      "status": "passed"
    }
  },
  "smokeTests": [],
  "source": {
    "commit": "7868cb9251fad80a73d26e488a5ad5f6c4a9f335",
    "path": "skills/analytics",
    "repository": "coreyhaines31/marketingskills",
    "url": "https://github.com/coreyhaines31/marketingskills/tree/7868cb9251fad80a73d26e488a5ad5f6c4a9f335/skills/analytics"
  },
  "status": "extracted"
}
