{
  "apiVersion": "effecta.dev/v1",
  "artifact": {
    "digest": "sha256:6c97672dbe1d0e95b5e9f3c1f5d5a5e3d6a538592ca0f6d6ee37563f92080fb7",
    "mediaType": "application/vnd.effecta.skill.directory.v1",
    "path": "community-skills/design/jpa-patterns--affaan-m-ecc"
  },
  "compatibility": {
    "declared": false,
    "runtimes": [
      "agent-skill"
    ]
  },
  "content": {
    "digest": "sha256:6c97672dbe1d0e95b5e9f3c1f5d5a5e3d6a538592ca0f6d6ee37563f92080fb7",
    "fileCount": 1,
    "totalBytes": 4970
  },
  "dependencies": {
    "items": [],
    "status": "not-declared"
  },
  "kind": "CapabilityRelease",
  "license": {
    "redistribution": "allowed",
    "spdx": "MIT"
  },
  "packageId": "github:affaan-m/ecc:.kiro/skills/jpa-patterns",
  "permissions": {
    "commands": [],
    "filesystem": [],
    "network": [],
    "status": "not-declared"
  },
  "releaseId": "sha256:b4b184b7f9bf182ee556ebed8eb290fd6ef3b9582706e53025489b721eb743ba",
  "security": {
    "staticScan": {
      "findings": [],
      "status": "passed"
    }
  },
  "smokeTests": [],
  "source": {
    "commit": "c9de8f5b2b3a225bca9befa2b7700aa5e3a4d1b8",
    "path": ".kiro/skills/jpa-patterns",
    "repository": "affaan-m/ECC",
    "url": "https://github.com/affaan-m/ECC/tree/c9de8f5b2b3a225bca9befa2b7700aa5e3a4d1b8/.kiro/skills/jpa-patterns"
  },
  "status": "extracted"
}
