{
  "apiVersion": "effecta.dev/v1",
  "artifact": {
    "digest": "sha256:2840070c84748fed0a6b4613e95bab2d04a9b3361bb6e5701d1993fae2051a4b",
    "mediaType": "application/vnd.effecta.skill.directory.v1",
    "path": "community-skills/workflow/django-celery--affaan-m-ecc"
  },
  "compatibility": {
    "declared": false,
    "runtimes": [
      "agent-skill"
    ]
  },
  "content": {
    "digest": "sha256:2840070c84748fed0a6b4613e95bab2d04a9b3361bb6e5701d1993fae2051a4b",
    "fileCount": 1,
    "totalBytes": 13134
  },
  "dependencies": {
    "items": [],
    "status": "not-declared"
  },
  "kind": "CapabilityRelease",
  "license": {
    "redistribution": "allowed",
    "spdx": "MIT"
  },
  "packageId": "github:affaan-m/ecc:skills/django-celery",
  "permissions": {
    "commands": [],
    "filesystem": [],
    "network": [],
    "status": "not-declared"
  },
  "releaseId": "sha256:ed26a4d814ddeb650a4fd76d5a7d3b4f111f0360dae8c09871a50a5827e4cb55",
  "security": {
    "staticScan": {
      "findings": [],
      "status": "passed"
    }
  },
  "smokeTests": [],
  "source": {
    "commit": "c9de8f5b2b3a225bca9befa2b7700aa5e3a4d1b8",
    "path": "skills/django-celery",
    "repository": "affaan-m/ECC",
    "url": "https://github.com/affaan-m/ECC/tree/c9de8f5b2b3a225bca9befa2b7700aa5e3a4d1b8/skills/django-celery"
  },
  "status": "extracted"
}
