{
  "apiVersion": "effecta.dev/v1",
  "artifact": {
    "digest": "sha256:e19e6a1df0d5e1bc3b876f49c3a236751b31f4cee706790be8d1f8c54c955b8a",
    "mediaType": "application/vnd.effecta.skill.directory.v1",
    "path": "community-skills/workflow/verification-loop--affaan-m-ecc"
  },
  "compatibility": {
    "declared": false,
    "runtimes": [
      "agent-skill"
    ]
  },
  "content": {
    "digest": "sha256:e19e6a1df0d5e1bc3b876f49c3a236751b31f4cee706790be8d1f8c54c955b8a",
    "fileCount": 2,
    "totalBytes": 2839
  },
  "dependencies": {
    "items": [],
    "status": "not-declared"
  },
  "kind": "CapabilityRelease",
  "license": {
    "redistribution": "allowed",
    "spdx": "MIT"
  },
  "packageId": "github:affaan-m/ecc:.agents/skills/verification-loop",
  "permissions": {
    "commands": [],
    "filesystem": [],
    "network": [],
    "status": "not-declared"
  },
  "releaseId": "sha256:f7c23fc772af3bbf90863949a46cc6ca6448a28c327a239154314c5f1d55fb85",
  "security": {
    "staticScan": {
      "findings": [],
      "status": "passed"
    }
  },
  "smokeTests": [],
  "source": {
    "commit": "c9de8f5b2b3a225bca9befa2b7700aa5e3a4d1b8",
    "path": ".agents/skills/verification-loop",
    "repository": "affaan-m/ECC",
    "url": "https://github.com/affaan-m/ECC/tree/c9de8f5b2b3a225bca9befa2b7700aa5e3a4d1b8/.agents/skills/verification-loop"
  },
  "status": "extracted"
}
