{
  "apiVersion": "effecta.dev/v1",
  "artifact": {
    "digest": "sha256:d3b30f2dd13ff2fd6b3e7785d1c4bdb1d4cfba12ee8012e01a58bbd14c0fb77e",
    "mediaType": "application/vnd.effecta.skill.directory.v1",
    "path": "community-skills/workflow/bioservices--k-dense-ai-scientific-agent-skills"
  },
  "compatibility": {
    "declared": false,
    "runtimes": [
      "agent-skill"
    ]
  },
  "content": {
    "digest": "sha256:d3b30f2dd13ff2fd6b3e7785d1c4bdb1d4cfba12ee8012e01a58bbd14c0fb77e",
    "fileCount": 8,
    "totalBytes": 108606
  },
  "dependencies": {
    "items": [],
    "status": "not-declared"
  },
  "kind": "CapabilityRelease",
  "license": {
    "redistribution": "allowed",
    "spdx": "MIT"
  },
  "packageId": "github:k-dense-ai/scientific-agent-skills:skills/bioservices",
  "permissions": {
    "commands": [],
    "filesystem": [],
    "network": [],
    "status": "not-declared"
  },
  "releaseId": "sha256:f9703155459a143f6cf16c7932852c1c06bbdb20dca813d875f76de519138cec",
  "security": {
    "staticScan": {
      "findings": [],
      "status": "passed"
    }
  },
  "smokeTests": [],
  "source": {
    "commit": "b2a92ba052dcae4ef48e850b9e31ebf75706be48",
    "path": "skills/bioservices",
    "repository": "K-Dense-AI/scientific-agent-skills",
    "url": "https://github.com/K-Dense-AI/scientific-agent-skills/tree/b2a92ba052dcae4ef48e850b9e31ebf75706be48/skills/bioservices"
  },
  "status": "extracted"
}
